"","PRACE","Female","Male"
"1","Hispanic or Latino","CLN-Building Cleaning and Pest Control Workers","EXT-Construction Trades Workers"
"2","Asian alone","CMM-Computer Specialists","CMM-Computer Specialists"
"3","Some Other Race alone","MGR-Other Management Occupations","CMM-Computer Specialists"
"4","Two or More Races","MGR-Other Management Occupations","CMM-Computer Specialists"
"5","White alone","MGR-Other Management Occupations","CMM-Computer Specialists"
"6","American Indian or Alaskan Native Alone","SAL-Retail Sales Workers","EXT-Construction Trades Workers"
"7","Black or African American alone","HLS-Nursing, Psychiatric, and Home Health Aides","PRS-Motor Vehicle Operators"
"8","Native Hawaiian and Other Pacific Islander alone","PRS-Material Moving Workers","PRS-Material Moving Workers"
